title,lyrics
Quickly,"Quickly Lyrics[Verse 1]
If I had 20 million dollars in the vault somewhere, baby
It wouldn't matter anyway, yeah
Cause the doctor told me that I'm dying slowly
So I guess I gotta love you while I'm here baby
Did you know ?

[Pre-Hook]
News said that the sky is fallin'
The globe is warmin'
My country's warin'
The leaders are lying
Time is runnin'
Lower and lower babe, lower babe
[Hook]
I know we just met
But baby could you love me quickly, quickly
I want you to love me like ya know the worlds about to end, baby
Quickly

[Verse 2]
You told me I don't even know your name
I said well then we might as well make ours the same
What you think, baby?
(No time)
Vegas might as well be lightyears away
So we better lay under the stars
Before they crashin' down
Cause I heard

[Pre-Hook]
News said that the sky is fallin'
The globe is warmin'
My country's warin'
The leaders are lying
Time is runnin'
Lower and lower babe, lower babe

[Hook]
I know we just met
But baby could you love me quickly, quickly
I want you to love me like ya know the worlds about to end, baby
Quickly
You might also like[Bridge]
That's right baby kiss me like the earth is quaking
Like the Earth is shakin'
You got it baby
That's right love me
Feel me like our time is sprinting faster
Running out on us

[Hook]
I know we just met
But baby could you love me quickly, quickly
Gotta love me like you know the worlds about to end, baby
Quickly, yeah

Barely know me baby
But you gotta love me quickly, quickly, oh
Gotta love me like you know the worlds about to end, baby
Quickly

Gotta love me baby, quick now
Gotta love me baby, quickly now
Gotta love me like you know the worlds about to end, baby
Quickly

[Outro]
Lou said the sky was fallin, yeah
Lou said
Oh na na3Embed"
One Look,"One Look Lyrics[Verse 1]
I've seen it and I liked it much
I told myself I had to have it
I looked, but I do not touch
Wondering why does she walk like that (that, that)
There was something in those jeans
Locked up
It was dying to be free
And it was bound to happen, oh

[Pre-Hook 1]
Didn't have a pick up line to use
I was way too cool, way too cool
And instead I hoped you're watching me too
Like I watched you
[Hook 1]
It took one look, oh, oh, oh
Just that one look, oh, oh
What was I to do but look?
Oh, I couldn't stop staring
Oh, I couldn't run away from you
No, I couldn't stop
No, no, just took one look

[Hook 2]
That's a good look baby, baby
That's a good look, darling
That's a good look, good look
Such a good look

My eyes must have been on drugs
Your color and your shape looked so crazy
I couldn't see the floor beneath you
But, baby, I could see you pacing on
Thin air, mid-air, no
Long brown hair swinging, no
Red bottoms in your high heels
Like I'm watching a Blu-Ray

[Pre-Hook 2]
You in HD baby
I didn't know what to say
I was way too cool, I’m way too cool
Yeah yeah yeah yeah
And I, you know I'm hoping you're watching me too
Oh yeah, you know it's true
You might also like[Hook 1]
It took one look, oh, oh, oh
Just that one look, oh, oh
What was I to do but look?
Oh, I couldn't stop staring
Oh, I couldn't run away from you
No, I couldn't stop
No, no, just took one look

[Bridge]
I wanna stare at you some more
When I can feel you in my soul
I'm not looking from the outside
I could feel your hands in mine
I wanna grab on your body
Touching that booty
Feeling on your booty
Say that you love it
And you said it's all mine

[Hook 1]
It took one look, oh, oh, oh
Just that one look, oh, oh
What was I to do but look?
Oh, I couldn't stop staring
Oh, I couldn't run away from you
No, I couldn't stop
No, no, just took one look
It took one look, oh, oh, oh
Just that one look, oh, oh
What was I to do but look?
Oh, I couldn't stop staring
Oh, couldn't run away from you
No, couldn't stop
No, no, just took one look

[Hook 2]
That's a good look baby (baby)
That's a good look, darling
That's a good look, good look
Such a good look
That's a good look baby (baby)
That's a good look, darling
That's a good look, good look
Such a good lookEmbed"
Static,"Static Lyrics[Intro]
La da da da daaaa (Okay...cause it never felt like that)
La da da da daaaa ( uh uh... its like)
Ohh (Every touch.. every kiss...static baby)
Ohhh (hahah..yeah)

[Verse 1]
Baby, I don't really know which way to go
It's like your energy keep callin'
I, Im bout to lose my self composure
Even sex has got me braggin'
And You, you look so good
I wish you would give me what Im looking for
Touch is so electric
Got my heart racing. Pulse is off the charts
And I can't even front. I'll be there 1 on 1
And you're the one I want girl
[Hook]
You're like static
It's way beyond me girl, its like magic
Got me feenin' for your touch like an addict. Gotta have it
Girl this thing feels so good, so I wish you would
You're like static
Girl this thing feels so good, so I wish you would

[Verse 2]
And I ain't even playing girl
Theres so much truth in what Im saying girl
You got my head all in it. Like a game of chess baby check me
This ain't no first date. Don't hesitate. No ??
And Ima take it nice and slow, yeah. Take your body where it needs to go
Give me what Im looking for. Touch is so electric
Got my heart racing. Pulse is off the charts
And I can't even front, I need the 1 on 1
You're the one I want, girl

[Hook]

[Verse 3]
Doin' 85 on a freeway. Switchin' lanes in my ""range""
GPS is saying next exit. I got your text message
I'm on my way to you. Here's what were gonna do
And girl I'll take it to you. Fit closer, don't stop
Don't mess up the flow. Don't be scared
Touch right there. Make it personal
I don't really know what it is that you do
Its like a force, im stuck onto you like static
You might also like[Hook]Embed"
I Need Love,"I Need Love Lyrics[Intro]
Oh, oh

[Verse 1]
Every girl that I met on tour
I knew none of them would last
Cause it wouldn’t work, nah it wouldn’t work
A hundred chick contacts in my phone
About half of them I smashed
I put in work, oh, I put in work
But there's something missin' there though
Feels like I've gotta lambo with no gas to go
And I've got all the world, nothing to show
That girl just let me know
[Hook]
I need love
Yeah, I need you, yeah, I need you
I need love
Yeah, I need you, oh I need
I need love in the morning
In the afternoon
I need love all night, all night
I need love, need love, need love, need love
Need love

[Verse 2]
Two weeks ago
I would've never admit I had it bad, oh
I wouldn't do it, nah, no
Cause fifteen days ago
Never knew you, so never knew how this felt
Had no clue, I was too cool
But now I can't go a day without ya'
I wake up eating breakfast thinking 'bout ya'
We'll go around the world, don't ever go
No, don't ever leave me 'lone

[Hook]
I need love
Yeah, I need you, yeah, I need you
I need love
Yeah, I need you, oh I need
I need love in the morning
In the afternoon
I need love all night, all night
I need love, need love, need love, need love
Need love
You might also like[Bridge]
I wanna wake up from this dream
No sleep full of dreams, I'll stay
And I know it'll work girl
There's no where I'd rather be
Because I need

[Hook]
I need love
Yeah, I need you, yeah, I need you
I need love
Yeah, I need you, oh I need
I need love in the morning
In the afternoon
I need love all night, all night
I need love, need love, need love, need love
Need love

[Outro]
Baby in the night
Oh1Embed"
Stay If You Go,"Stay If You Go Lyrics[Verse 1]
My baby, my sweet pumpkin pie
My honey, my darling, my love
I only really miss him when he’s gone
Cause when we’re together we argue two thirds of the time
And I miss him more than a fraction when we part

[Pre-Chorus]
Oh, oh you’re calling me crazy
Saying I’m always complaining
I tell you, just leave me alone
Here you go
You’re packing your things and
You're lacing your sneakers
I’m screaming get out
[Chorus]
But don’t go, don’t go
Don’t go, don’t go, don’t go
I say that you should leave but don’t go
Don’t go, don’t go, don’t go
Don’t go, go, go, go, go, go, go, go

[Verse 2]
Sugar bunches of oats
My buttered toast on the side
My full serving of love
And then it’s like
Whenever it’s just me and you
You know I don’t wanna fight
But I know that you know my buttons
And when to press them, baby, dammit

[Pre-Chorus]
Oh, oh you’re calling me crazy
Saying I’m always complaining
I tell you, just leave me alone
Here you go
You’re packing your things and
You're lacing your sneakers
I’m screaming get out
You might also like[Chorus]
But don’t go, don’t go
Don’t go, don’t go, don’t go
I say that you should leave but don’t go
Don’t go, don’t go, don’t go
Don’t go, go, go, go, go, go, go, go

[Bridge]
I told you to go
So why did you leave
I beg you to stay
I want you to go
So why did you leave
I told you to go
So why don't you stay
I begged you to stay
So why are you here
You gotta leave

[Verse 3]
Boy, you know I bet the sun won't set
Before we go at it again
It’s just gon’ happen
I don’t understand it
My heart’s sane
But my mind’s going crazy
[Chorus]
But don’t go, don’t go
Don’t go, don’t go, don’t go
I say that you should leave but don’t go
Don’t go, don’t go, don’t go
Don’t go, go, go, go, go, go, go, go

[Outro]
I told you to go
So why did you leave
I beg you to stay
I want you to go
So why did you leave
I told you to go
So why don't you stay
I begged you to stay
So why are you here
I want you to leave

Oh, just go
No stay, go
Stay, go, stay, go, stayEmbed"
Dear April (Justice Remix),"Dear April (Justice Remix) Lyrics[Verse]
Dear April, the only face in the crowd that I know
Dear April, are you watchin' him?
Are you watchin' him dance?
Dear April, we were safe for a while
We were safe as the years flew by
If you could take two strangers
Lead them left and right
At a certain place
In time, like you took these strangers
And our two strange lives
And made us new
I believe no matter what
Take us through it
And wake us up again
And what we had can't be the same now
Just like you made me new
Just like you took me through it
Just like you woke me up
You made me new
Took me through it
Woke me up
You woke me up
[Build]
We had can't be the s-, we had can't be the s-
We had can't be the s-, we had can't be the s-
We had can't be the s-, we had can't be the s-
What we had can't be the same now
We had can't be the s-, we had can't be the s-
We had can't be the s-, we had can't be the s-
We had can't be the s-, we had can't be the s-
What we had can't be the same now
We had can't be the s-, we had can't be the s-
We had can't be the s-, we had can't be the s-
We had can't be the s-, we had can't be the s-
What we had can't be the same now
We had can't be the s-, we had can't be the s-
We had can't be the s-, we had can't be the s-
We had can't be the s-, we had can't be the s-
What we had can't be the same now

[Drop]
Are you watchin' him? Are you watchin' him?
Are you watchin' him dance?
What we had can't be the same now
Are you watchin' him? Are you watchin' him?
Are you watchin' him dance?
What we had can't be the same now
You might also like[Build]
We had can't be the s-, we had can't be the s-
What we had can't be the same now
We had can't be the s-, we had can't be the s-
We had can't be the s-, we had can't be the s-
We had can't be the s-, we had can't be the s-
What we had can't be the same now

[Drop]
Are you watchin' him? Are you watchin' him?
Are you watchin' him dance?
What we had can't be the same now
Are you watchin' him? Are you watchin' him?
Are you watchin' him dance?
What we had can't be the same now

[Outro]
We had can't be the s-, we had can't be the s-
We had can't be the s-, we had can't be the s-
We had can't be the s-, we had can't be the s-
What we had can't be the same now
We had can't be the s-, we had can't be the s-
We had can't be the s-, we had can't be the s-
We had can't be the s-, we had can't be the s-
What we had can't be the same now
We had can't be the s-, we had can't be the s-
We had can't be the s-, we had can't be the s-
What we had can't be the s-, we had can't be the s-
What we had can't be the same now
We had can't be the s-, we had can't be the s-
We had can't be the s-, we had can't be the s-
We had can't be the s-, we had can't be the s-
What we had can't be the same now
We had can't be the s-, we had can't be the s-
We had can't be the s-, we had can't be the s-
We had can't be the s-, we had can't be the s-
What we had can't be the same now2Embed"
Night.s (Demo),"Night.s (Demo) Lyrics[Intro]
Go for it

[Verse 1]
Round your city, round the clock
Everybody needs you
No, you can't make everybody equal
Although you got beaucoup family
You don't even got nobody, being honest with you
Breathe 'til I evaporate
My whole body see-through
Transportation, handmade (G!)
And I know it better than most people
I don't trust 'em anyways
You can't break the law with them
Get some pussy, have a calm night
Shooters killing left and right
Working through your worst night
If I get my money right, you know I won't need you
And I tell you (Biiitch!)
I hope the sack is full up
I'm fuckin', no, I'm fucked up
Spend it when I get that, I ain't tryna keep you
Can't keep up a conversation, can't nobody reach you
Why your eyes well up?
Did you call me from a séance?
You were from my past life, hope you're doing well, bruh
I been out here head first
Always like the head first, signal coming in and out (Huh?)
Hope you're doing well, bruh
Everybody needs you
Everybody needs you
Oooh, nani nani (Ooh, nani, oh)
This feel like a quaalude
No sleep in my body
Ain't no bitch in my body, ugh!
[Pre-Chorus]
New beginnings, ahh
New beginnings, wake up, akh
The sun's going down
Time to start your day, bruh
Can't keep being late on me
Know you need the money if you gon' survive
The every night shit, everyday shit

[Chorus]
Dropping baby off at home before my night shift
You know I can't hear none of that spend-the-night shit
That kumbaya shit
Wanna see nirvana, but don't wanna die yet
Wanna feel that nana, though, could you come by?
Fuck with me after my shift
Know them boys wanna see me broke down and shit
Bummed out and shit, stressed out and shit
That's everyday shit
Shut the fuck up, I don’t want your conversation
Rolling marijuana, that's a cheap vacation
My every day shit, every night shit, every day shit
Every night shit
Night shit, night shit, night shit, night shit

[Verse 2]
Bubble goose down, blue punch
Pocari Sweat, ghost sweat
Her wet wet, her mouth wet, two things I don't regret
My dick long, memory long, two things she don't forget
Game drives so wet, my Black friends just wear black
But only fly in black jets, if it's roulette, black's best
Niggas ain't sold crack yet
Flyin' private, ain't wasting seats
Niggas lapped up in that bitch
Black bodies in the summer breeze
Runnin' four flats, tryna get in the lead
Tryna get in the league and play wide receiver
Nigga, pass the sticks, call winners winners
Up-seat, gotta walk it off
Winners hate to lose, gotta run they mouth
Sets thrown, now they lockin' up
We ain't break it up
Tryna see who face getting knotted up
That was Monday, we was back friends on Tuesday
Still talkin' 'bout it 'til this day
Need fifty hunnas, that's 5 racks
Hit Costco, keep the fam fat
Fuck a weed-man, grow your own plants
Tell the cashier give you five blacks and the purple packs
Some loud burnin' out on the grill
Black Adonis on the diving board
Gainers only, I'm bringing Guinness
Jordans floatin' on the deep end of the pool (Yes)
Somebody got thrown in again, y'all are fools
Phone drown on the concrete in the summer blaze
Blaze too, blaze too
And it better work when the morning breaks through
You might also like[Break]
Oh we gon' line it up? Nah, nah
I just... What?!

[Pre-Chorus]
New beginnings, ahh
[Inaudible talking]
New beginnings wake up, akh
The sun's going down
(I just got these shoes man)
Time to start your day, bruh
(Look at 'em... Look, they're fucked)
Can't keep being late on me
(Some more fuckin' shit)
Know you need the money if you gon' survive
[Inaudible talking]
The every night shit, every day shit

[Chorus]
Dropping baby off at home before my night shift
You know I can't hear none of that spend-the-night shit
That kumbaya shit
Wanna see nirvana, but don't wanna die yet
Wanna feel that nana, though, could you come by?
Fuck with me after my shift
Know them boys wanna see me broke down and shit
Bummed out and shit, stressed out and shit
That's everyday shit
Shut the fuck up, I don’t want your conversation
Rolling marijuana that's a cheap vacation
My everyday shit, every night shit, everyday shit
Every night shit
Night shit, night shit, night shit
[Post-Chorus]
I'm buck now, I'm peaked out
I'm in the red like chyoon-chyoon-chyoon
On they heads like chyoon chyoon chyoon
Remember that, them hands yea
Them strokes, oh, don't watch that
We both know
You used to be my everyday, every night shit
I'm buck now, I'm peaked out
I'm in the red like chyoon-chyoon-chyoon
On they heads like chyoon-chyoon-chyoon
Remember that, them hands yea
Them strokes, oh, don't watch that
We both know
You used to be my everyday, every night shit

[Instrumental Outro]2Embed"
Follow,"Follow Lyrics[Verse One]
I looked you in the eyes
I crossed my heart and hope to die
I will never let them cry
I held you in my arms
Said I won't let go until you feel you’re ready
'Til you feel you’re ready

Told me on the phone
Something bout you love me
Ooh baby say it to my face
I could have a place in your world
Kinda like your army, your air force, your peace corps
[Chorus]
So baby follow, follow, follow
Tell me where you want to go
Just keep your body close and don't let go
Follow, follow, follow
Baby let me be the guide
Just listen for the signs
And when I tell you right, left, switch it up
Imma take it slow, Imma take it slow, oh
Oh baby stop there, right there
Don't lose control, don't lose control, oh
Now baby look up at the star
If you wanna go, promise we can go, oh
You just gotta follow, follow, follow
You just gotta follow, follow, follow

[Verse Two]
Oh, baby if you like
We can go to paradise
Be back by the next sunrise
And no, I won't stay in Rome
I never go faster the limit, not unless you with it

And you told me on the phone
Said you wanna love me
Well baby tell me how it feels
Gotta have place in your world
Something like no other, your lover, your best friend, oh
You might also like[Chorus]
So baby follow, follow, follow
Tell me where you want to go
Just keep your body close and don't let go
Follow, follow, follow
Baby let me be the guide
Just listen for the signs
And when I tell you right, left, switch it up
Imma take it slow, Imma take it slow, oh
Oh baby stop there, right there
Don't lose control, don't lose control, oh
Now baby look up at the star
If you wanna go, promise we can go, oh
You just gotta follow, follow, follow
You just gotta follow, follow, follow

[Bridge]
Left, right, switch it up
Oh, we gotta pick it up now, slow it down
Hell yeah, switch it up
No we just can't let it fall down
Gotta keep it that, that, that, that
I can never quite get enough
Gotta keep your back arched up
Follow the leader, baby girl
It's going down, down, down
Down down down
[Alternate Chorus]
Now move it right, left, switch it up
Imma take it slow, Imma take it slow, oh
Oh baby baby stop there, right there
Don't lose control, don't lose control, oh
Now baby look up at the star
If you wanna go, promise we can go, oh
You just gotta follow, follow, follow
You just gotta follow, follow, follow2Embed"
Disillusioned,"Disillusioned Lyrics[Hook]
Disillusioned, ooh ooh
Disillusioned, ooh ooh
Disillusioned, ooh ooh
What's the solution now?

[Verse 1]
Don't you see I'm here for ya'
All your best interest are on my heart
I just wanna grow wit'ya...
And never let the nature break us apart
The Well endowed took the earth and changed it
A thousand grapes in the middle never knew they were…?
Never shared any knowlege for confirmation, of their relation...Ohh Hallelujah!
Disillusioned !
[Hook]
Disillusioned,(yeah) ooh ooh
Disillusioned, ooh ooh
Disillusioned, ooh ooh
What's the solution now?

[Verse2]
Can't you feel a thing child?
Can't you tell she's feeling so used
Said you should make your mind up
Since you know how to feels to be abused
It wasn't... the concept of nation...
To divide the one consciousness
Young and wild, taking spaceships
.....
Searching for a path out of delusion
Disillusioned!

[Hook]
Disillusioned, ooh ooh
Disillusioned, ooh ooh
Disillusioned, ooh ooh
What's the solution now?

[Verse 3(rapping)]
We gon' drink 'til the DJ plays our song and then turn this mother fucker out
Turn it out. Right
We gon' drink til the DJ plays your song and then turn this block party out right right
Turn it out uh uh
You been waiting in this long ass line girl
Turn this club out right
You been waiting in this long ass line girl
Turn this bitch out, right?
You been waiting in this long ass line girl
Turn this mother fucker out
Turn it out
Uh !
You might also like[Hook]
Disillusioned, ooh ooh
Disillusioned, (uh) ooh ooh
Disillusioned, ooh ooh
What's the illusion now?

[Harmonizes]
Badabadamamama4Embed"
Time Machine,"Time Machine Lyrics[Intro]
Get on my bike and I'ma fly through time
Until I'm with you
I promise

[Verse 1]
I'm scared
I guess I shouldn't be
But I'm a boy
In this adult body
I know I said
That we would grow old together
But I haven't
And that's cost you years
[Pre-Chorus]
This is has been the one of my fears
That's has only ever caused you tears

[Chorus]
So time machine, take me ahead till I'm with her
Gotta be with her, with her, with her
Can't let her live by herself
Oh time machine, maybe we can take her with us
Long as I'm with her, with her, with her
She ain't living by herself
Lift off and go

[Verse 2]
I tried
With all my might, I peddled as fast as I could
Until the years just started to flicker past
Our life, oh all of it
I saw memories on both sides of the road
I pointed them out as I went along
Right there, we're making out listening to Purple Rain in the basement
And just ahead I can see your heart falling but I can't save it

[Pre-Chorus]
This is has been the one of my fears
That's has only ever caused you tears
You might also like[Chorus]
So time machine, take me ahead till I'm with her
Gotta be with her, with her, with her
Can't let her live by herself
Oh time machine, maybe we can take her with us
Long as I'm with her, with her, with her
She ain't living by herself

[Bridge]
I'm on my way there
To that time in space
I wish you could see, all that I see now
I'm headed towards you, yeah
I wish that time could wait
I'm on my way home

[Pre-Chorus]
This is has been the one of my fears
That's has only ever caused you tears

[Chorus]
So time machine, take me ahead till I'm with her
Gotta be with her, with her, with her
Can't let her live by herself
Oh time machine, maybe we can take her with us
Long as I'm with her, with her, with her
She ain't living by herself
Lift off and go
Lift off and go2Embed"
Try,"Try Lyrics[Verse 1]
I guess it felt a little bit better when we were still arguing about it
Cause in the words I could still hear love
Somebody still cared
And I would rather sleep on the sofa as long as you're still in our bed
At least I'm sure that you're at home and you ever left me yeah

[Hook]
You said you know my heart is good
But you'd hate me if you could
If I would allow you to you would
You could, you should but don't
[Chorus]
Try to leave me
Try to stay
Giving up
Is harder baby
Don't try don't try
Don't try to leave girl
Try to stay
Try, try

[Verse 2]
It's breaking my heart to see you there
Sickening I hate standing at that station
It's a picture that I don't wanna frame
Tears in your eyes
Luggage at your side

[Hook x2]
You said you know my heart is good
But you'd hate me if you could
If I would allow you to you would
You could, you should but don't
You said you know my heart is good
But you'd hate me if you could
If I would allow you to you would
You could, you should but don't
You might also like[Verse 3]
You ain't gotta work too hard
Tryna break my heart
But don't try, don't try, don't try
You ain't gotta work too hard
Trying to move on ohh oh
Try to stay
Try to think

[Chorus]
Don't try to leave me
Try to stay
Giving up
Is harder baby
Don't try don't try
Don't try to leave girl
Try to stay
Try
Try, try
Just try8Embed"
Only You,"Only You Lyrics[Verse 1]
Sitting by my window
Watching the moonlight
In my home
Suddenly my mind
Is bringing out desire
In my home
So I got a new man
To put out this fire
Burning in my soul
[Chorus]
Only you, baby
Can put out this fire
Only you, Steve
Can put out this fire
Burning in my soul
Only you, baby
Can put out this fire

[Verse 2]
So I had a phone call
From a new man
In my home
He was burning
Burning of desire
Just like I do
He wanted me to
Put out this fire
Burning in his soul

[Chorus]
Only you, baby
Can put out this fire
Only you, Steve
Can put out this fire
Burning in my soul
Only you, baby
Can put out this fire
Only you, baby
Can put out this fire
Burning in my soul
You might also like[Verse 3]
Suddenly my new man
Was in my arms
In my home
He was loving me
69 times
In my home
So I got a new man
To put out this fire
Burning in my soul

[Chorus]
Only you, baby
Can put out this fire
Only you, Steve
Can put out this fire
Burning in my soul
Only you, baby
Can put out this fire
Only you, baby4Embed"
